<?xml version="1.0" encoding="UTF-8"?>
<!DOCTYPE imobiliaria [
    <!ELEMENT imobiliaria (imovel+)>
    <!ELEMENT imovel (descricao, proprietario, endereco, caracteristicas, valor)>
    <!ELEMENT descricao (#PCDATA)>
    <!ELEMENT proprietario (nome, (email*, telefone+))>
    <!ELEMENT nome (#PCDATA)>
    <!ELEMENT email (#PCDATA)>
    <!ELEMENT telefone (#PCDATA)>
    <!ELEMENT endereco (rua, bairro, cidade, numero?)>
    <!ELEMENT rua (#PCDATA)>
    <!ELEMENT bairro (#PCDATA)>
    <!ELEMENT cidade (#PCDATA)>
    <!ELEMENT numero (#PCDATA)>
    <!ELEMENT caracteristicas (tamanho, numQuartos, numBanheiros)>
    <!ELEMENT tamanho (#PCDATA)>
    <!ELEMENT numQuartos (#PCDATA)>
    <!ELEMENT numBanheiros (#PCDATA)>
    <!ELEMENT valor (#PCDATA)>
]>

<imobiliaria>
    <imovel>
        <descricao>Apartamento com varanda gourmet</descricao>
        <proprietario>
            <nome>Luciana Moreira</nome>
            <email>luciana.moreira@example.com</email>
            <telefone>+55 21 91234-5678</telefone>
        </proprietario>
        <endereco>
            <rua>Rua das Palmeiras</rua>
            <bairro>Botafogo</bairro>
            <cidade>Rio de Janeiro</cidade>
            <numero>45</numero>
        </endereco>
        <caracteristicas>
            <tamanho>140m²</tamanho>
            <numQuartos>3</numQuartos>
            <numBanheiros>3</numBanheiros>
        </caracteristicas>
        <valor>R$ 1.800.000,00</valor>
    </imovel>
    <imovel>
        <descricao>Casa de campo com pomar</descricao>
        <proprietario>
            <nome>Roberto Lima</nome>
            <telefone>+55 11 99887-6543</telefone>
        </proprietario>
        <endereco>
            <rua>Estrada da Fazenda</rua>
            <bairro>Campo Alegre</bairro>
            <cidade>São Paulo</cidade>
        </endereco>
        <caracteristicas>
            <tamanho>350m²</tamanho>
            <numQuartos>5</numQuartos>
            <numBanheiros>4</numBanheiros>
        </caracteristicas>
        <valor>R$ 3.500.000,00</valor>
    </imovel>
    <imovel>
        <descricao>Apartamento moderno</descricao>
        <proprietario>
            <nome>Fernanda Costa</nome>
            <email>fernanda.costa@example.com</email>
            <telefone>+55 31 98765-1234</telefone>
        </proprietario>
        <endereco>
            <rua>Av. Contorno</rua>
            <bairro>Funcionários</bairro>
            <cidade>Belo Horizonte</cidade>
            <numero>789</numero>
        </endereco>
        <caracteristicas>
            <tamanho>95m²</tamanho>
            <numQuartos>2</numQuartos>
            <numBanheiros>2</numBanheiros>
        </caracteristicas>
        <valor>R$ 950.000,00</valor>
    </imovel>
    <imovel>
        <descricao>Chácara com piscina e churrasqueira</descricao>
        <proprietario>
            <nome>Marcos Ribeiro</nome>
            <email>marcos.ribeiro@example.com</email>
            <telefone>+55 41 99987-6543</telefone>
        </proprietario>
        <endereco>
            <rua>Estrada do Campo</rua>
            <bairro>Zona Rural</bairro>
            <cidade>Curitiba</cidade>
            <numero>100</numero>
        </endereco>
        <caracteristicas>
            <tamanho>600m²</tamanho>
            <numQuartos>6</numQuartos>
            <numBanheiros>5</numBanheiros>
        </caracteristicas>
        <valor>R$ 3.800.000,00</valor>
    </imovel>
    <imovel>
        <descricao>Kitnet próxima ao metrô</descricao>
        <proprietario>
            <nome>Júlia Fernandes</nome>
            <telefone>+55 61 99998-7654</telefone>
        </proprietario>
        <endereco>
            <rua>Rua das Oliveiras</rua>
            <bairro>Asa Norte</bairro>
            <cidade>Brasília</cidade>
        </endereco>
        <caracteristicas>
            <tamanho>35m²</tamanho>
            <numQuartos>1</numQuartos>
            <numBanheiros>1</numBanheiros>
        </caracteristicas>
        <valor>R$ 350.000,00</valor>
    </imovel>
</imobiliaria>